2043	Who was killed by a white police officer?	2
2044	When was the first case of death from coronavirus disease reported in the Central African Republic?	2
2045	What are some of the preventive measures in public places?	0
2046	What will not affect the effectiveness of immunization and can be replaced in time?	0
2047	What should you do after taking off the mask?	0
2048	Where was the first confirmed case of 2019 coronavirus disease reported?	2
2049	What were the subjects exposed to the studied factors?	4
2050	What is not used as a basis for diagnosis?	1
2051	What are the three categories of epidemiological research content?	4
2052	What is one of the main factors affecting the study effect?	4
2053	What should public transport staff pay attention to?	0
2054	"How many people were confirmed in Germany on April 11, 2021?"	2
2055	What are mammalian coronaviruses mainly  and?	0
2056	What is congested and focally hemorrhagic in the spleen Phenomenon?	1
2057	How many deaths from coronavirus disease did Brazil have in 2019?	2
2058	"What is the name of the chapter in ""I. General preventive measures""?"	0
2059	"Who was diagnosed with New Coronary Pneumonia on October 27, 2020?"	2
2060	What is the purpose of glucocorticoids?	1
2061	What was the number of confirmed coronavirus disease in Turkey in 2021?	2
2062	What type of treatment should be based on for adults?	1
2063	What type of evidence was present in confirmed cases?	1
2064	What should the public avoid wearing a medical mask?	0
2065	How many sachets do Jinhua Qingxian granules take?	1
2066	What symptoms do pregnant mothers need to monitor their body temperature and keep records of?	0
2067	What is the significance of the infectious period?	4
2068	What do the duties of medical workers in this epidemic dictate that they have?	0
2069	What type of condition is critical type?	1
2070	What did the laboratory send the test report back to the hospital on December 30?	2
2071	What type of life is important in daily life?	0
2072	Who must wear masks to travel and avoid dense crowds?	0
2073	What is the overall level of the disease epidemic in China?	2
2074	When was the number of confirmed coronavirus disease in Brazil?	2
2075	Where was the number of confirmed coronavirus disease in 2021?	2
2076	What are some myocardial cells showing degeneration and necrosis?	1
2077	What symptoms should be seen at a fever clinic when the disease worsens?	0
2078	What is the name of the hospital that is responsible for the diagnosis of novel coronavirus pneumonia?	0
2079	What must procurement staff wear to avoid direct hand contact with meat and poultry raw materials?	0
2080	At what time did Li Wenliang post the test report?	2
2081	"How many people confirmed Coronavirus disease in Indonesia on August 24, 2021?"	2
2082	What type of care was given to critically ill patients?	1
2083	What can you do to improve your resistance?	0
2084	What is the study of a specific range of the entire population called?	4
2085	What is the isolation of an intermediate host of novel coronavirus?	0
2086	What may be used in patients with moderate to severe acute respiratory distress syndrome or with invasive mechanical ventilation with FiO2 above 50%?	1
2087	Which country has more than 4 million confirmed cases of coronavirus disease?	2
2088	What is the name of the mask that is used to prevent respiratory infections?	0
2089	What is a moderate increase in the intake of essential fatty acids?	0
2090	What should patients do to help themselves?	0
2091	Where was the number of confirmed coronavirus disease confirmed?	2
2092	What type of preventive measures are in public places?	0
2093	What must be cooked before eating?	0
2094	What should the final disinfection of the private car be done after the patient gets out of the car?	0
2095	How much water does Xuanlung Defeat Poison Granules take daily?	1
2096	"What did the CDC switch to on January 15, 2020?"	2
2097	How many people were diagnosed with coronavirus disease in the United States in 2019?	2
2098	What has Zhang Boli done for patients?	3
2099	Who is the Shanghai medical treatment team leader?	3
2100	What are the main symptoms of MIS-C?	1
2101	"How many Coronavirus disease deaths did Brazil have on October 9, 2021?"	2
2102	"What country confirmed in more than 1 million people on May 6, 2021?"	2
2103	What kind of skin are elderly people prone to?	0
2104	What is the name of the type of coronavirus detected in the nasopharynx and gastrointestinal mucosa?	1
2105	What is the third pandemic strain of Newcastle pneumonia?	2
2106	How many people were diagnosed with neo-coronavirus in France in 2022?	2
2107	What are the main symptoms of a coronavirus?	1
2108	Who is responsible for direct treatment and care of the case?	0
2109	What type of evidence does the novel coronavirus vaccine have?	1
2110	What should an elderly person wear on the way to medical treatment?	0
2111	What is the minimum distance from human contact?	0
2112	Where was Zhang Xinzhong the director of?	3
2113	What should the CDC clean?	0
2114	How long apart from sampling should a negative novel coronavirus nucleic acid test be?	1
2115	When was the largest quarantine event in human history?	2
2116	What should be stored in an airtight manner to reduce the density of flies?	0
2117	"How many new cases of 2019 coronavirus disease were notified by the Wuhan Health Commission from May 10, 2020 to May 11, 2020?"	2
2118	What is the most common mode when only respiratory support is required?	1
2119	Who are the Heavy/Critical Early Warning Indicators for?	1
2120	How many patients were admitted to Raytheon Hill Hospital as of Feb. 16?	3
2121	What is the goal of the epidemic sniper?	3
2122	What condition is a critical type condition?	1
2123	How many people voted for the resolution on the response to the 2019 coronavirus disease outbreak?	2
2124	Who passed the proposal for an independent investigation into the pneumonia virus?	2
2125	Who was diagnosed with New Crown Pneumonia?	2
2126	What does a cohort study test?	4
2127	What title did the Ministry of Public Security award in February 2020?	3
2128	What will medical workers be when they are busy with a lot of clinical work every day?	0
2129	When did Liu Daqing leave the army to work in Linyi City Detention Center?	3
2130	What is the latest version of the National Health Commission's protocol?	0
2131	What should the cleaning utensils used in each area be separated?	0
2132	What mainly analyzes the difference or change of morbidity and mortality of different age groups in the same era?	4
2133	"What could have serious social, economic and political consequences for these regions?"	2
2134	"How many people died in the United States on September 24, 2021?"	2
2135	What should you do to avoid crowds?	0
2136	What should an elderly person wear on the way to medical treatment?	0
2137	What are some symptoms of novel coronavirus pneumonia similar to the common cold?	0
2138	"What can be replaced by medical staff after wearing protective masks, disposable hats, and disposable hats?"	0
2139	What should be kept open for a long time for elevators with ventilation fans installed in the cabin?	0
2140	How long is Xuanlung Defeat Poison Granules treatment?	1
2141	"On what date were the first confirmed cases of 2019 coronavirus disease reported in Armenia, the Czech Republic, and Dominica?"	2
2142	"How many deaths were there on July 17, 2021?"	2
2143	How many intensive care unit cases of influenza illness were selected for re-testing?	2
2144	What is a vital sign at rest and after activity?	1
2145	Who was the president of Wuhan Lei Shen Shan Hospital?	3
2146	"What can be found in ""(2) Washing hands regularly""?"	0
2147	What do passive and active activities promote?	1
2148	What is the name of the second pandemic strain of pneumonia?	2
2149	"What drugs can be used in combination with Xiyamping injection, Hemopride injection, Heat poisoning injection?"	1
2150	"How many people were confirmed with coronavirus disease in Colombia on June 24, 2021?"	2
2151	"What type of disease may present with low-grade fever, mild malaise, smell and taste disturbances, and no pneumonia?"	1
2152	How old was Liang Wudong when he died?	3
2153	What type of therapy should patients with PaO2/FiO2 below 200 mmHg be given?	1
2154	"How many deaths did the number of newly diagnosed pneumonia cases exceed on December 12, 2021?"	2
2155	What should family members wear when entering the isolated person's activity space?	0
2156	"Which countries reported the first confirmed cases of coronavirus disease on March 11, 2020?"	2
2157	In what country was coronavirus disease confirmed in more than 1 million people in 2019?	2
2158	What strategy is implemented after ECMO?	1
2159	Where should specimens be isolated if they meet the case definition of a suspected case or a positive result of a new coronavirus	1
2160	What should children be instructed to do when they go outside?	0
2161	How many confirmed coronavirus cases were recorded in the United States in 2019?	2
2162	What do you need to do if stress symptoms have occurred?	0
2163	How many provinces and cities in mainland China were free of new confirmed cases in late February 2020?	2
2164	Where was the first confirmed case of coronavirus disease reported?	2
2165	Who did not receive the novel coronavirus-specific IgM and IgG antibodies?	1
2166	Which country surpassed China in the number of confirmed cases of coronavirus disease in 2019?	2
2167	What can be placed by the sink to make it easy to apply after washing hands?	0
2168	What can all be increased appropriately?	0
2169	What can a person who meets the above conditions be able to be discharged from isolation management?	1
2170	How long does the needles stay for?	1
2171	"Along with blood, urine, and biochemical parameters, what does the patient need to monitor?"	1
2172	What type of disinfectant should be used for the surface of objects with more human contact?	0
2173	What do medical personnel leave the isolation area to take off?	0
2174	"How many pneumonia deaths were there in the United States on December 12, 2020?"	2
2175	"How many people died in Germany on November 22, 2021?"	2
2176	What is a PaCO2 for more than 6 hours and respiratory rate > 35 breaths/min?	1
2177	Which two coronaviruses cause severe respiratory diseases?	0
2178	Who should receive booster vaccination in a timely manner?	1
2179	In what way should positive nucleic acid test results be managed?	1
2180	"How many ""zero infections"" did Wuhan Vulcan Mountain Hospital achieve in 2003?"	3
2181	What is recommended for patients with routine review of malignant tumors to delay the review without affecting the prognosis of the disease?	0
2182	What do parents need to give love and care during the special times when the epidemic is raging?	0
2183	"How many people were diagnosed with coronavirus disease on February 9, 2022?"	2
2184	Recent studies have demonstrated the possibility of what type of transmission of novel coronavirus?	0
2185	How to take Lianhua Qingfei Capsules?	1
2186	What is a random sampling method?	4
2187	What type of infiltration does hepatocyte degeneration and focal necrosis have?	1
2188	What type of treatment is recommended for patients with postoperative adjuvant?	0
2189	What is the most important thing at present?	0
2190	When did many European countries tighten their epidemic prevention measures?	2
2191	In what country is Coronavirus disease confirmed in more than 6 million people?	2
2192	What is the term for the total number of healthy life years lost from onset to death?	4
2193	What do patients remove before leaving the clean area?	0
2194	What can a passenger do to avoid riding in the elevator with more than one stranger?	0
2195	What type of gloves should be worn during disinfection?	0
2196	What is the lung tissue prone to?	1
2197	What can Xiyamping and Hemopride be used in combination with?	1
2198	"What type of immunotherapy is recommended for patients with deterioration of oxygenation index, rapid imaging progress, and over-activation of the organism"	1
2199	What should attention be paid to while actively correcting the etiology?	1
2200	What are the studies on the physicochemical properties of human coronaviruses?	0
2201	"On March 15, 2022, the number of confirmed coronavirus disease in Korea exceeded how many?"	2
2202	What type of treatment should be given to patients with PaO2/FiO2 below 300 mmHg?	1
2203	What is V. Diagnosis?	1
2204	What is the total fat energy supply ratio of the total dietary energy?	0
2205	When does the WHO suspend all major events and public performances until?	2
2206	What is the name of the acupuncture treatment for critically ill patients?	1
2207	What is the name of the novel coronavirus?	0
2208	What was the name of the first pandemic strain of Newcastle pneumonia?	2
2209	What is the fourth pandemic strain of NCCP?	2
2210	"What stores did the Italian government shut down on March 4, 2020?"	2
2211	Who must wear masks and inquire and register the status of outsiders?	0
2212	What can reduce the incidence of novel coronavirus infection and disease?	1
2213	How was the expected number of deaths for a cause of disease obtained?	4
2214	Why should you be protected if you must go out?	0
2215	Who urged further investigation of potential early events?	2
2216	How long is the course of treatment for Lianhua Qingxian granules?	1
2217	What is occasionally positive for novel coronavirus nucleic acid?	1
2218	What does a medical worker feel they are stronger than they are?	0
2219	How many people were diagnosed with coronavirus disease worldwide in 2022?	2
2220	What are examples of public classrooms that a group of students can go in and disinfect once?	0
2221	"What can you do if you are already depleted, helpless and frustrated?"	0
2222	What is the main goal of health education?	0
2223	How long does it take for an outbreak to occur?	0
2224	What is the name of the prevention of novel coronavirus?	1
2225	How many people were diagnosed with coronavirus disease in the United States in 2019?	2
2226	What should you do before playing with your child?	0
2227	"What percentage of alcohol, ether, chloroform, formaldehyde, chlorinated disinfectants, peroxyacetic acid and UV"	0
2228	"Patients with what type of symptoms may have low-grade fever, mild malaise, smell and taste disturbances, and no pneumonia?"	1
2229	What is the conclusion of the COVID-19 study?	0
2230	How many suspected cases are there?	1
2231	What is the cumulative incidence of a disease calculated by using the population size at the beginning of the observation as the denominator?	4
2232	What is the name of the organ that is positive for novel coronavirus nucleic acid?	1
2233	"What type of tongue has little fluid, thin or weak pulse?"	1
2234	"On what date was a paper titled ""New coronavirus has spread in France at the end of December 2019"" published?"	2
2235	What should medical personnel do to avoid cross-infection in the contaminated area?	0
2236	Who are the Special Populations Prevention measures for?	0
2237	How long were patients monitored during the infusion?	1
2238	What is the epithelium of the bronchial mucosa at all levels of the lung?	1
2239	How many meters can separate meeting participants in the elevator?	0
2240	What should be done as soon as possible to prevent the spread of the coronavirus?	0
2241	What should nursing seniors avoid sharing?	0
2242	What does the general population need to do to protect against coronavirus pneumonia?	0
2243	How do psychological reactions affect health care workers?	0
2244	What are the two types of animal coronaviruses?	0
2245	How to take Lianhua Qingfei Capsules?	1
2246	What is the only way a sniper can target the new coronavirus?	3
2247	What is the maximum dose of tolimumab?	1
2248	What is more sensitive and fragile than the elderly?	0
2249	How many types of nutritional supplements are there?	0
2250	Older people older than what age?	1
2251	What refers to the effect of an ongoing study on the person being studied?	4
2252	What does the length of the incubation period determine?	4
2253	Who loves to walk around during the New Year holidays?	0
2254	What is the term for those who meet one of the following conditions?	1
2255	How many people were diagnosed with coronavirus disease worldwide in 2022?	2
2256	What is the proportion of all patients suffering from a disease who die from that disease in a certain period of time?	4
2257	"When will public elementary, junior high and high schools nationwide be temporarily closed for the holiday until the end of spring break?"	2
2258	How many member states endorsed Australia's proposal for an independent investigation into the traceability of the pneumonia virus?	2
2259	What should you do when you go out?	0
2260	Who surpasses China in 2019 coronavirus disease deaths for the first time?	2
2261	What is the diameter of the novel coronavirus?	1
2262	"How many deaths are caused by the United States, India and Brazil?"	2
2263	What does novel coronavirus pneumonia require hospitalization and?	0
2264	What should family members wear masks when entering the isolated person's activity space?	0
2265	What is the recommended acupuncture point for acupuncture treatment?	1
2266	How many new cases were diagnosed in the United States in a single day?	2
2267	How long does it take for ECMO to begin?	1
2268	"How many people were confirmed with coronavirus disease in Poland on December 2, 2020?"	2
2269	"What should be worn when performing tracheal intubation, bronchoscopy, airway care and suctioning?"	0
2270	What is infiltration in the lamina propria and submucosa?	1
2271	What refers to the fraction of total population morbidity attributable to exposure?	4
2272	When was the first case of 2019 coronavirus disease reported in Tajik?	2
2273	What should you do when you go to the hospital?	0
2274	What is the term for the incidence of a disease at a general level over the years?	4
2275	How many deaths were caused by coronavirus in Taiwan in 2022?	2
2276	What is a subject exposed to a substance to be studied?	4
2277	What are some problems with consciousness?	0
2278	Patients with what type of hypertension should have their blood pressure measured daily?	0
2279	How many deaths worldwide were confirmed with coronavirus disease in 2019?	2
2280	"Who was diagnosed with New Coronary Pneumonia on October 25, 2020?"	2
2281	A larger area of the epidemic or a number of epidemic sites in a row is called what?	4
2282	What is the name of the two places where patients can seek medical attention if they are suspected of having a new coronavirus infection?	0
2283	How long is the acupuncture retained for?	1
2284	What does glucocorticosteroids recommend for a short period of time?	1
2285	What is an example of an active surveillance?	4
2286	What is a medical surgical mask?	0
2287	What does the body temperature return to normal for more than 3 days?	1
2288	What are the treatment principles based on?	1
2289	What is a good thing about working hours?	0
2290	What is the fifth pandemic strain of NCCP?	2
2291	What does the hospital do for children with a temperature above 37.3C?	0
2292	What is the name of the mask that is used to treat novel coronavirus pneumonia?	0
2293	How many cases are there in the community?	0
2294	What do patients need to do to vent their negative emotions?	0
2295	"On February 28, 2022, the number of confirmed coronavirus disease in South Korea exceeded how many?"	2
2296	What is a simple sampling method?	4
2297	How many capsules does Lianhua Qingfei capsules take once a day?	1
2298	How many people did Shaligengacha rescue?	3
2299	What was used to evaluate the statistical association between the factors and the disease?	4
2300	What can you call when self-adjustment is difficult?	0
2301	What are some examples of exposed populations?	4
2302	What is the tongue of the Chinese patent medicine?	1
2303	What do medical personnel leave the isolation area to take off?	0
2304	"What is a case after the onset of one of the following exposure scenarios, but did not take effective protection?"	0
2305	Which countries reported the first confirmed cases of 2019 coronavirus disease?	2
2306	When did Lesotho report the first confirmed case of coronavirus disease?	2
2307	What is the name of the child?	0
2308	Where were the first deaths of 2019 coronavirus disease reported?	2
2309	What types of infectious disease contacts require medical observation?	4
2310	What is not recommended for the elderly?	0
2311	What is important to be prepared for?	0
2312	"How many Coronavirus disease deaths did the United States have on September 24, 2021?"	2
2313	Who sent the sample to Wuhan Central Hospital?	2
2314	"On December 10, 2021, the number of confirmed coronavirus disease in France exceeded how many people?"	2
2315	Who was the President of Portugal?	2
2316	What are some of the biochemical parameters that are monitored according to the condition?	1
2317	What is the basic formula of Clear Lung Detox Soup?	1
2318	What type of quick-drying hand sanitizer is available?	0
2319	How long after the onset of the disease is the novel coronavirus infection more contagious?	1
2320	Where was the first confirmed case of 2019 coronavirus disease reported?	2
2321	What is essential to wash your hands regularly?	0
2322	What types of masks do not work?	0
2323	Who was Johnny Bricenius?	2
2324	What is the name of the disease that has no significant association between cases in terms of time and place of onset Outbreak?	4
2325	Where should a doctor see a child with a fever?	0
2326	What is recall bias?	4
2327	How many new crown cases did India confirm in a single day?	2
2328	"What can be used to disinfect the button panel, handrail, and other parts frequently touched by passengers?"	0
2329	What do special people wear?	0
2330	How many people were diagnosed with coronavirus disease worldwide in 2022?	2
2331	What is the arterial partial pressure of oxygen/inhaled oxygen concentration?	1
2332	What is the tongue of the patient?	1
2333	Who said that coronavirus disease has been fully disclosed the number of recovery?	2
2334	What are some forms of health education used to popularize?	0
2335	Where should heavy and critical cases be treated?	1
2336	What is a small area or a single source of infection called?	4
2337	The testes showed reduced spermatogenic cell numbers and degeneration of what cells?	1
2338	What may survivors of a disease have changed to reduce the level of a risk factor?	4
2339	What should be done before work?	0
2340	"On March 17, 2022, the number of confirmed coronavirus disease in South Korea exceeded how many?"	2
2341	"When will public elementary, junior high and high schools be temporarily closed for the holiday until the end of spring break?"	2
2342	Who urged further investigation of potential early events?	2
2343	Where was the first confirmed case of 2019 coronavirus disease reported?	2
2344	What is the death toll of Coronavirus disease in Peru in 2021?	2
2345	When was the number of confirmed coronavirus disease confirmed in more than 10 million people?	2
2346	What can laboratory conditions cause?	4
2347	Who reported the first case of 2019 coronavirus disease death?	2
2348	What is the term for a study where the original queue members can constantly exit after a certain queue is determined?	4
2349	What vital signs should be closely monitored at rest and after activity?	1
2350	How many deaths did the number of newly diagnosed pneumonia cases exceed?	2
2351	What are some of the supplies that are used by close contacts?	0
2352	How many people were diagnosed with coronavirus disease worldwide in 2022?	2
2353	What do patients pay attention to to maintain the stability of the internal environment?	1
2354	Where was the first case of 2019 coronavirus disease death reported?	2
2355	What is another name for reinfusing?	1
2356	What types of control populations are selected?	4
2357	What is making the diagnosis?	1
2358	Who needs special attention in the prevention and control of novel coronavirus pneumonia outbreaks?	0
2359	How much is Pericarpium Citri Reticulatae?	1
2360	What is the main factor affecting the study effect?	4
2361	What is the epidemic point?	0
2362	How long does novel coronavirus pneumonia usually recover?	0
2363	What has Zhang Boli done for patients?	3
2364	What can happen if we are infected with the coronavirus?	0
2365	"How long did it take to get to the second 100,000 cases of the New Crest Pneumonia pandemic?"	2
2366	How many deaths from Coronavirus disease did the United States have in 2019?	2
2367	What type of items do you regularly share with others?	0
2368	What is the axillary body temperature 37.3C?	0
2369	How many people were diagnosed with coronavirus disease globally on a single day in 2019?	2
2370	What was the number of confirmed coronavirus disease in the UK in 2019?	2
2371	What was the number of confirmed coronavirus disease in Spain in 2021?	2
2372	Where should children have a history of travel or residence?	0
2373	What is the process of putting on and taking off protective equipment for medical personnel?	0
2374	How many people were diagnosed with coronavirus disease worldwide in 2022?	2
2375	The number of confirmed coronavirus disease diagnoses in the United States in 2019 surpassed that of what country?	2
2376	What should children wear when their faces are small?	0
2377	How long does it take for two or more cases of unknown origin to spread in the community?	0
2378	What is required to disinfect teaware before entering the office building?	0
2379	Where should you seek medical attention if you develop respiratory symptoms?	1
2380	On what floors can passengers take the stairs on foot?	0
2381	"What can be used early in the course of the disease in patients with high risk factors, high viral load and rapid disease progression?"	1
2382	What was the number of confirmed coronavirus disease in mainland China in 2021?	2
2383	"When did Libya, El Salvador, South Africa, Serbia, Slovakia, Lebanon, Panama, and Kazakhstan declare states of emergency?"	2
2384	What is Wang Xinghuan's motto?	3
